<?xml version="1.0" encoding="UTF-8"?>
<!DOCTYPE NOMENCLATURE SYSTEM "Dtd-Nomenclature.dtd">
<NOMENCLATURE>
<CONCEPT>
<ID>http://data.education.fr/voc/scolomfr/concept/learner</ID>
<DF lang="fr">Public cible</DF>
<NA lang="fr">Personne qui exploite, travaille avec la ressource afin d'apprendre quelque chose. Concept issu du LOMFR.</NA>
<TERME>
<INTITULE lang="fr">apprenant</INTITULE>
<ID>learner</ID>
</TERME>
<TERME_TE>
<INTITULE lang="fr">apprenant</INTITULE>
<ID>scolomfr-voc-011-num-003</ID>
</TERME_TE>
<TERME_TA>
<INTITULE lang="fr">élève à besoins éducatifs spécifiques</INTITULE>
<ID>scolomfr-voc-021-num-0008</ID>
</TERME_TA>
<TERME_TA>
<INTITULE lang="fr">élève</INTITULE>
<ID>scolomfr-voc-021-num-0007</ID>
</TERME_TA>
<TERME_TA>
<INTITULE lang="fr">étudiant</INTITULE>
<ID>scolomfr-voc-021-num-0012</ID>
</TERME_TA>
</CONCEPT>
<CONCEPT>
<ID>http://data.education.fr/voc/scolomfr/concept/author_2</ID>
<DF lang="fr">Public cible</DF>
<NA lang="fr">Personne qui utilise ou réutilise une ressource à des fins de production. Concept issu du LOMFR.</NA>
<TERME>
<INTITULE lang="fr">auteur</INTITULE>
<ID>author</ID>
</TERME>
<TERME_TE>
<INTITULE lang="fr">auteur</INTITULE>
<ID>scolomfr-voc-011-num-002</ID>
</TERME_TE>
</CONCEPT>
<CONCEPT>
<ID>http://data.education.fr/voc/scolomfr/concept/teacher</ID>
<DF lang="fr">Public cible</DF>
<NA lang="fr">Personne responsable par les activités de transmission des connaissances et compétences dans le cadre de la "formation tout au long de la vie". Inclut les tuteurs. Concept issu du LOMFR.</NA>
<TERME>
<INTITULE lang="fr">enseignant</INTITULE>
<ID>teacher</ID>
</TERME>
<TERME_TE>
<INTITULE lang="fr">enseignant</INTITULE>
<ID>scolomfr-voc-011-num-001</ID>
</TERME_TE>
<TERME_TA>
<INTITULE lang="fr">enseignant des disciplines</INTITULE>
<ID>scolomfr-voc-021-num-0009</ID>
</TERME_TA>
<TERME_TA>
<INTITULE lang="fr">enseignant documentaliste</INTITULE>
<ID>scolomfr-voc-021-num-0010</ID>
</TERME_TA>
<TERME_TA>
<INTITULE lang="fr">enseignant du supérieur</INTITULE>
<ID>scolomfr-voc-021-num-0011</ID>
</TERME_TA>
<TERME_TA>
<INTITULE lang="fr">professeur des écoles</INTITULE>
<ID>scolomfr-voc-021-num-0023</ID>
</TERME_TA>
</CONCEPT>
<CONCEPT>
<ID>http://data.education.fr/voc/scolomfr/concept/manager</ID>
<DF lang="fr">Public cible</DF>
<NA lang="fr">Personne qui gère ou déploie des ressources. Concept issu du LOMFR.</NA>
<TERME>
<INTITULE lang="fr">gestionnaire</INTITULE>
<ID>manager</ID>
</TERME>
<TERME_TE>
<INTITULE lang="fr">gestionnaire</INTITULE>
<ID>scolomfr-voc-011-num-004</ID>
</TERME_TE>
<TERME_TA>
<INTITULE lang="fr">personnel de direction</INTITULE>
<ID>scolomfr-voc-021-num-0019</ID>
</TERME_TA>
</CONCEPT>
<CONCEPT>
<ID>http://data.education.fr/voc/scolomfr/concept/manager</ID>
<DF lang="fr">Public cible</DF>
<NA lang="fr">Personne qui gère ou déploie des ressources. Concept issu du LOMFR.</NA>
<TERME>
<INTITULE lang="fr">gestionnaire</INTITULE>
<ID>manager</ID>
</TERME>
<TERME_TE>
<INTITULE lang="fr">gestionnaire</INTITULE>
<ID>scolomfr-voc-011-num-004</ID>
</TERME_TE>
<TERME_TA>
<INTITULE lang="fr">personnel de direction</INTITULE>
<ID>scolomfr-voc-021-num-0019</ID>
</TERME_TA>
</CONCEPT>
<CONCEPT>
<ID>http://data.education.fr/voc/scolomfr/concept/author_2</ID>
<DF lang="fr">Public cible</DF>
<NA lang="fr">Personne qui utilise ou réutilise une ressource à des fins de production. Concept issu du LOMFR.</NA>
<TERME>
<INTITULE lang="fr">auteur</INTITULE>
<ID>author</ID>
</TERME>
<TERME_TE>
<INTITULE lang="fr">auteur</INTITULE>
<ID>scolomfr-voc-011-num-002</ID>
</TERME_TE>
</CONCEPT>
<CONCEPT>
<ID>http://data.education.fr/voc/scolomfr/concept/teacher</ID>
<DF lang="fr">Public cible</DF>
<NA lang="fr">Personne responsable par les activités de transmission des connaissances et compétences dans le cadre de la "formation tout au long de la vie". Inclut les tuteurs. Concept issu du LOMFR.</NA>
<TERME>
<INTITULE lang="fr">enseignant</INTITULE>
<ID>teacher</ID>
</TERME>
<TERME_TE>
<INTITULE lang="fr">enseignant</INTITULE>
<ID>scolomfr-voc-011-num-001</ID>
</TERME_TE>
<TERME_TA>
<INTITULE lang="fr">enseignant des disciplines</INTITULE>
<ID>scolomfr-voc-021-num-0009</ID>
</TERME_TA>
<TERME_TA>
<INTITULE lang="fr">enseignant documentaliste</INTITULE>
<ID>scolomfr-voc-021-num-0010</ID>
</TERME_TA>
<TERME_TA>
<INTITULE lang="fr">enseignant du supérieur</INTITULE>
<ID>scolomfr-voc-021-num-0011</ID>
</TERME_TA>
<TERME_TA>
<INTITULE lang="fr">professeur des écoles</INTITULE>
<ID>scolomfr-voc-021-num-0023</ID>
</TERME_TA>
</CONCEPT>
<CONCEPT>
<ID>http://data.education.fr/voc/scolomfr/concept/learner</ID>
<DF lang="fr">Public cible</DF>
<NA lang="fr">Personne qui exploite, travaille avec la ressource afin d'apprendre quelque chose. Concept issu du LOMFR.</NA>
<TERME>
<INTITULE lang="fr">apprenant</INTITULE>
<ID>learner</ID>
</TERME>
<TERME_TE>
<INTITULE lang="fr">apprenant</INTITULE>
<ID>scolomfr-voc-011-num-003</ID>
</TERME_TE>
<TERME_TA>
<INTITULE lang="fr">élève à besoins éducatifs spécifiques</INTITULE>
<ID>scolomfr-voc-021-num-0008</ID>
</TERME_TA>
<TERME_TA>
<INTITULE lang="fr">élève</INTITULE>
<ID>scolomfr-voc-021-num-0007</ID>
</TERME_TA>
<TERME_TA>
<INTITULE lang="fr">étudiant</INTITULE>
<ID>scolomfr-voc-021-num-0012</ID>
</TERME_TA>
</CONCEPT>
</NOMENCLATURE>
